Sheet: Herramientas
B2: Escuela Politecnica del Ejercito
B3: Departamento de ciencias de la energia y mecanica
B5: HERRAMIENTAS DE LA MAQUINA: VIWA VTC
B6: Portaherramienta MWLNR 2525 M08 | C6: 39.20 | D6: 9.80 | E6: 0.03
B7: Portaherramienta MTJNR 2525 M16 | C7: 39.20 | D7: 9.80 | E7: 0.03
B8: Portaherramienta MDJNR 2525 M15 | C8: 39.20 | D8: 9.80 | E8: 0.03
B9: Porta de tronzado y ranurado LT | C9: 285.00 | D9: 71.25 | E9: 0.19
D10: Costo Hora Total | E10: =SUM(R[-3]C:R[-1]C) -> 1

Sheet: mano de obra
B2: Escuela Politecnica del Ejercito
B3: Departamento de ciencias de la energia y mecanica
B5: MANO DE OBRA DE LA MAQUINA: FADAL VMC
B6: Mantenimiento | C6: Laboratorista | D6: 60 | E6: 420.65 | F6: 36.8570927889249102
B7: Operacion de la maquinaria | C7: Laboratorista | D7: 60 | E7: 420.65 | F7: 36.8570927889249102
B8: Programar | C8: Disenador | D8: 40 | E8: 150.00 | F8: 13.1429072110750898
B9: Mantenimiento ayudante | C9: Ayudante | D9: 60 | E9: 150.00 | F9: 13.1429072110750898
D10: Valor de mano de obra | E10: =SUM(R[-3]C:R[-1]C) -> 1
B12: MANO DE OBRA DE LA MAQUINA: VIWA VTC
B13: Mantenimiento | C13: Laboratorista | D13: 60 | E13: 420.65 | F13: 36.8570927889249102
B14: Operacion de la maquinaria | C14: Laboratorista | D14: 60 | E14: 420.65 | F14: 36.8570927889249102
B15: Programar | C15: Disenador | D15: 40 | E15: 150.00 | F15: 13.1429072110750898
B16: Mantenimiento ayudante | C16: Ayudante | D16: 60 | E16: 150.00 | F16: 13.1429072110750898
D17: Valor de mano de obra | E17: =SUM(R[-3]C:R[-1]C) -> 1

Sheet: Consumibles
B2: Escuela Politecnica del Ejercito
B3: Departamento de ciencias de la energia y mecanica
B5: CONSUMIBLES DE LA MAQUINA: FADAL VMC
B6: Fresa planear LT 610-M-W-D80/6 | C6: 582.00 | D6: 0.30
B7: Fresa de escuadra LT730-M-W-D50 | C7: 396.00 | D7: 0.21
B8: Fresa de alto avance LT 900 W-W-D25/3 Roseta | C8: 349.00 | D8: 0.18
B9: Fresa de alto avance LT 900 M-W-D250/6 Roseta | C9: 571.00 | D9: 0.30
B10: Fresa de ranurado LT720 W-W-D16/2 | C10: 224.00 | D10: 0.12
B11: Fresa de ranurado LT720 W-W-D25/3 | C11: 238.00 | D11: 0.12
B12: Insertos SEKT 12T3 AGSN LT 30 | C12: 10.84 | D12: 0.06
B13: Insertos SNKX 09T3 -HF | C13: 17.61 | D13: 0.09
B14: Insertos APKT 1604 PDRT LT 30 | C14: 10.84 | D14: 0.06
B15: Insertos APKT 160424 ER LT 30 | C15: 10.84 | D15: 0.06
C16: Costo Hora total | D16: =SUM(R[-9]C:R[-1]C) -> 1
B18: CONSUMIBLES DE LA MAQUINA: VIWA VTC
B19: Insertos WNMG 080404 NN LT10 | C19: 10.00 | D19: 0.05
B20: Insertos WNMG 160404 NN LT10 | C20: 8.50 | D20: 0.04
B21: Insertos WNMG 160408 NN LT10 | C21: 8.50 | D21: 0.04
B22: Insertos WNMG 150708 NN LT10 | C22: 11.90 | D22: 0.06
C23: Costo Hora total | D23: =SUM(R[-3]C:R[-1]C) -> 1

Sheet: Actividades
B2: Escuela Politecnica del Ejercito
B3: Departamento de ciencias de la energia y mecanica
B5: REPORTE DE ACTIVIDADES DE: Disenador
B6: Disenar | C6: 60 | D6: 225.00
B7: Programar | C7: 40 | D7: 150.00
B8: Servicios administracion | C8: 40 | D8: 150.00
B9: Promocion de servicios | C9: 20 | D9: 75.00
C10: Salario | D10: =SUM(R[-3]C:R[-1]C) -> 1
C11: Horas de trabajo total | D11: =SUM(R[-4]C[-1]:R[-2]C[-1]) -> 1

Sheet: Mantenimiento
B2: Escuela Politecnica del Ejercito
B3: Departamento de ciencias de la energia y mecanica
B5: MANTENIMIENTO DE LA MAQUINA: VIWA VTC
B6: Castrol Magda BD68 | C6: 31.49 | D6: 3 | E6: 94.47 | F6: 0.05
B7: Mobil shc #32 | C7: 17.29 | D7: 3 | E7: 69.16 | F7: 0.04
B8: Fanuc A02B-0200-K102 | C8: 31.49 | D8: 4 | E8: 125.96 | F8: 0.07
B9: Dow Frost | C9: 31.49 | D9: 3 | E9: 94.47 | F9: 0.05
D10: Costo Mantenimiento Preventivo: | E10: =SUM(R[-3]C:R[-1]C) -> 1 | F10: =SUM(R[-3]C:R[-1]C) -> 1
D11: Costo Mantenimiento Correctivo: | E11: 1500.00 | F11: 0.78125000000000000000
D12: Costo Mantenimiento: | E12: =SUM(R[-2]C:R[-1]C) -> 1 | F12: =SUM(R[-2]C:R[-1]C) -> 1

Sheet: General
B2: Escuela Politecnica del Ejercito
B3: Departamento de ciencias de la energia y mecanica
B5: Lista de Maquinas en el sistema
B6: 3016 | C6: FADAL VMC | D6: 117311.00 | E6: 10 | F6: 1920 | G6: 11731.10 | H6: 12.22
B7: 1640 | C7: VIWA VTC | D7: 46540.00 | E7: 10 | F7: 1920 | G7: 4654.00 | H7: 4.85